{
  "schema_version": "1.0.0",
  "id": "SAST-SEMGRP-0001",
  "title": "Possible SQL injection",
  "description": "User-controlled input may be concatenated into a SQL statement.",
  "source_agent": "sast",
  "category": "vulnerability",
  "severity": "high",
  "confidence": 0.92,
  "evidence": [
    {
      "type": "code",
      "description": "Request input is concatenated into a database query.",
      "file": "src/database.py",
      "line_start": 42,
      "line_end": 42,
      "fingerprint": "sha256:example"
    }
  ],
  "sources": [
    {
      "name": "CWE",
      "reference": "CWE-89",
      "url": "https://cwe.mitre.org/data/definitions/89.html"
    }
  ],
  "constitutional_checks": [
    {
      "principle": "Findings must be supported by observable evidence.",
      "result": "pass",
      "explanation": "The affected file and line are identified."
    }
  ],
  "real_assessment": {
    "reality_based": true,
    "evidence_backed": true,
    "actionable": true,
    "linked": true,
    "score": 4
  },
  "status": "validated",
  "recommendation": "Use a parameterized query rather than constructing SQL with string concatenation.",
  "created_at": "2026-07-13T16:00:00-04:00"
}